{
  "boxrec_id": "811429",
  "boxrec_url": "https://boxrec.com/en/box-pro/811429",
  "name": "Joe Joyce",
  "slug": "joe-joyce",
  "birth_name": "Joseph Obey Joyce",
  "alias": "'Juggernaut'",
  "birth_date": null,
  "birth_place": "London, United Kingdom",
  "nationality": "United Kingdom",
  "stance": "orthodox",
  "height": "6\u2032 6\u2033 / 198cm",
  "reach": "80\u2033 / 203cm",
  "record": {
    "wins": 16,
    "losses": 4,
    "draws": 0,
    "kos": 0,
    "total_fights": 20
  },
  "division": "heavy",
  "rating": "",
  "ranking": null,
  "titles": [],
  "bouts_count": 20,
  "rounds_count": 113,
  "ko_percentage": "93.75%",
  "residence": "Putney, London, United Kingdom",
  "status": null,
  "career": "2017-2025",
  "debut": "2017-10-20",
  "sex": "male",
  "age": null,
  "company": null,
  "promoter": null,
  "manager_agent": null,
  "wiki": "https://boxrec.com/wiki/index.php?title=Human:811429",
  "bouts": [
    {
      "date": "Apr 25",
      "opponent": "Filip Hrgovic",
      "opponent_id": "813758",
      "opponent_url": "https://boxrec.com/en/box-pro/813758",
      "opponent_record": "17-1-0",
      "recent_form": "WWWWWL",
      "result": "L",
      "method": null,
      "rounds": null,
      "venue": "Co-op Live Arena, Manchester",
      "bout_rating": 3
    },
    {
      "date": "Jul 24",
      "opponent": "Derek Chisora",
      "opponent_id": "381739",
      "opponent_url": "https://boxrec.com/en/box-pro/381739",
      "opponent_record": "34-13-0",
      "recent_form": "LLLWLW",
      "result": "L",
      "method": null,
      "rounds": null,
      "venue": "O2 Arena, Greenwich",
      "bout_rating": 3
    },
    {
      "date": "Mar 24",
      "opponent": "Kash Ali",
      "opponent_id": "584978",
      "opponent_url": "https://boxrec.com/en/box-pro/584978",
      "opponent_record": "21-2-0",
      "recent_form": "WWWWWL",
      "result": "W",
      "method": null,
      "rounds": null,
      "venue": "bp pulse LIVE Arena, Birmingham",
      "bout_rating": 1
    },
    {
      "date": "Sep 23",
      "opponent": "Zhilei Zhang",
      "opponent_id": "692149",
      "opponent_url": "https://boxrec.com/en/box-pro/692149",
      "opponent_record": "25-1-1",
      "recent_form": "WDWWLW",
      "result": "L",
      "method": null,
      "rounds": null,
      "venue": "Wembley Arena, Wembley",
      "bout_rating": 3
    },
    {
      "date": "Apr 23",
      "opponent": "Zhilei Zhang",
      "opponent_id": "692149",
      "opponent_url": "https://boxrec.com/en/box-pro/692149",
      "opponent_record": "24-1-1",
      "recent_form": "WWDWWL",
      "result": "L",
      "method": null,
      "rounds": null,
      "venue": "Copper Box Arena, Queen Elizabeth Olympic Park, Hackney Wick",
      "bout_rating": 4
    },
    {
      "date": "Sep 22",
      "opponent": "Joseph Parker",
      "opponent_id": "613846",
      "opponent_url": "https://boxrec.com/en/box-pro/613846",
      "opponent_record": "30-2-0",
      "recent_form": "WWWWWW",
      "result": "W",
      "method": null,
      "rounds": null,
      "venue": "Manchester Arena, Manchester",
      "bout_rating": 4
    },
    {
      "date": "Jul 22",
      "opponent": "Christian Hammer",
      "opponent_id": "475159",
      "opponent_url": "https://boxrec.com/en/box-pro/475159",
      "opponent_record": "27-9-0",
      "recent_form": "WLWLLW",
      "result": "W",
      "method": null,
      "rounds": null,
      "venue": "Wembley Arena, Wembley",
      "bout_rating": 1
    },
    {
      "date": "Jul 21",
      "opponent": "Carlos Takam",
      "opponent_id": "355273",
      "opponent_url": "https://boxrec.com/en/box-pro/355273",
      "opponent_record": "39-5-1",
      "recent_form": "LLWWWW",
      "result": "W",
      "method": null,
      "rounds": null,
      "venue": "Wembley Arena, Wembley",
      "bout_rating": 2
    },
    {
      "date": "Nov 20",
      "opponent": "Daniel Dubois",
      "opponent_id": "787430",
      "opponent_url": "https://boxrec.com/en/box-pro/787430",
      "opponent_record": "15-0-0",
      "recent_form": "WWWWWW",
      "result": "W",
      "method": null,
      "rounds": null,
      "venue": "Church House, Westminster",
      "bout_rating": 4
    },
    {
      "date": "Jul 20",
      "opponent": "Michael Wallisch",
      "opponent_id": "531663",
      "opponent_url": "https://boxrec.com/en/box-pro/531663",
      "opponent_record": "20-3-0",
      "recent_form": "WWLLWL",
      "result": "W",
      "method": null,
      "rounds": null,
      "venue": "BT Sport Studio, Stratford",
      "bout_rating": 1
    },
    {
      "date": "Jul 19",
      "opponent": "Bryant Jennings",
      "opponent_id": "529630",
      "opponent_url": "https://boxrec.com/en/box-pro/529630",
      "opponent_record": "24-3-0",
      "recent_form": "WWWWWL",
      "result": "W",
      "method": null,
      "rounds": null,
      "venue": "O2 Arena, Greenwich",
      "bout_rating": 2
    },
    {
      "date": "May 19",
      "opponent": "Aleksandr Ustinov",
      "opponent_id": "314868",
      "opponent_url": "https://boxrec.com/en/box-pro/314868",
      "opponent_record": "34-3-0",
      "recent_form": "WWWWLL",
      "result": "W",
      "method": null,
      "rounds": null,
      "venue": "Lamex Stadium, Stevenage",
      "bout_rating": 1
    },
    {
      "date": "Feb 19",
      "opponent": "Bermane Stiverne",
      "opponent_id": "324806",
      "opponent_url": "https://boxrec.com/en/box-pro/324806",
      "opponent_record": "25-3-1",
      "recent_form": "WWWLWL",
      "result": "W",
      "method": null,
      "rounds": null,
      "venue": "O2 Arena, Greenwich",
      "bout_rating": 1
    },
    {
      "date": "Dec 18",
      "opponent": "Joe Hanks",
      "opponent_id": "431653",
      "opponent_url": "https://boxrec.com/en/box-pro/431653",
      "opponent_record": "23-2-0",
      "recent_form": "WWLLWW",
      "result": "W",
      "method": null,
      "rounds": null,
      "venue": "Staples Center, Los Angeles",
      "bout_rating": 1
    },
    {
      "date": "Sep 18",
      "opponent": "Iago Kiladze",
      "opponent_id": "422432",
      "opponent_url": "https://boxrec.com/en/box-pro/422432",
      "opponent_record": "26-3-0",
      "recent_form": "WWWWLL",
      "result": "W",
      "method": null,
      "rounds": null,
      "venue": "Citizens Business Bank Arena, Ontario",
      "bout_rating": 1
    },
    {
      "date": "Jun 18",
      "opponent": "Ivica Bacurin",
      "opponent_id": "450416",
      "opponent_url": "https://boxrec.com/en/box-pro/450416",
      "opponent_record": "30-13-1",
      "recent_form": "WLWLWW",
      "result": "W",
      "method": null,
      "rounds": null,
      "venue": "York Hall, Bethnal Green",
      "bout_rating": 1
    },
    {
      "date": "May 18",
      "opponent": "Lenroy Thomas",
      "opponent_id": "350528",
      "opponent_url": "https://boxrec.com/en/box-pro/350528",
      "opponent_record": "22-4-1",
      "recent_form": "WLWWWD",
      "result": "W",
      "method": null,
      "rounds": null,
      "venue": "O2 Arena, Greenwich",
      "bout_rating": 1
    },
    {
      "date": "Mar 18",
      "opponent": "Donnie Palmer",
      "opponent_id": "619859",
      "opponent_url": "https://boxrec.com/en/box-pro/619859",
      "opponent_record": "9-1-1",
      "recent_form": "WWLWWW",
      "result": "W",
      "method": null,
      "rounds": null,
      "venue": "York Hall, Bethnal Green",
      "bout_rating": 1
    },
    {
      "date": "Feb 18",
      "opponent": "Rudolf Jozic",
      "opponent_id": "751408",
      "opponent_url": "https://boxrec.com/en/box-pro/751408",
      "opponent_record": "4-1-0",
      "recent_form": "WWWLW",
      "result": "W",
      "method": null,
      "rounds": null,
      "venue": "York Hall, Bethnal Green",
      "bout_rating": 0
    },
    {
      "date": "Oct 17",
      "opponent": "Ian Lewison",
      "opponent_id": "485568",
      "opponent_url": "https://boxrec.com/en/box-pro/485568",
      "opponent_record": "12-3-1",
      "recent_form": "WWWWWL",
      "result": "W",
      "method": null,
      "rounds": null,
      "venue": "Indigo at The O2, Greenwich",
      "bout_rating": 1
    }
  ]
}