{
  "boxrec_id": "1055950",
  "boxrec_url": "https://boxrec.com/en/box-pro/1055950",
  "name": "Emiliano Vargas",
  "slug": "emiliano-vargas",
  "birth_name": "Emiliano Fernando Vargas",
  "alias": "El General",
  "birth_date": null,
  "birth_place": "Oxnard, California, Estados Unidos",
  "nationality": "Estados Unidos",
  "stance": "orthodox",
  "height": "5\u2032 9\u2033 / 175cm",
  "reach": "72\u2033 / 183cm",
  "record": {
    "wins": 15,
    "losses": 0,
    "draws": 0,
    "kos": 0,
    "total_fights": 15
  },
  "division": "superligero",
  "rating": "",
  "ranking": null,
  "titles": [],
  "bouts_count": 15,
  "rounds_count": 41,
  "ko_percentage": "86.67%",
  "residence": "Las Vegas, Nevada, Estados Unidos",
  "status": null,
  "career": "2022-2025",
  "debut": "2022-05-14",
  "sex": "male",
  "age": null,
  "company": null,
  "promoter": null,
  "manager_agent": null,
  "wiki": "https://boxrec.com/wiki/index.php?title=Human:1055950",
  "bouts": [
    {
      "date": "2025-07-26",
      "opponent": "Alexander Espinoza",
      "opponent_id": "740588",
      "opponent_url": "https://boxrec.com/es/box-pro/740588",
      "opponent_record": "20-3-1",
      "recent_form": "WWLLWW",
      "result": "W",
      "method": null,
      "rounds": null,
      "venue": "Madison Square Garden Theater, New York",
      "bout_rating": 1
    },
    {
      "date": "May 25",
      "opponent": "Juan Leon",
      "opponent_id": "818891",
      "opponent_url": "https://boxrec.com/es/box-pro/818891",
      "opponent_record": "11-2-1",
      "recent_form": "WWLWWW",
      "result": "W",
      "method": null,
      "rounds": null,
      "venue": "T-Mobile Arena, Las Vegas",
      "bout_rating": 1
    },
    {
      "date": "Mar 25",
      "opponent": "Giovannie Gonzalez",
      "opponent_id": "791016",
      "opponent_url": "https://boxrec.com/es/box-pro/791016",
      "opponent_record": "20-7-2",
      "recent_form": "LDLWWL",
      "result": "W",
      "method": null,
      "rounds": null,
      "venue": "Fontainebleau Las Vegas, Las Vegas",
      "bout_rating": 1
    },
    {
      "date": "Sep 24",
      "opponent": "Larry Fryers",
      "opponent_id": "769029",
      "opponent_url": "https://boxrec.com/es/box-pro/769029",
      "opponent_record": "13-6-1",
      "recent_form": "LLDLWW",
      "result": "W",
      "method": null,
      "rounds": null,
      "venue": "Desert Diamond Arena, Glendale",
      "bout_rating": 1
    },
    {
      "date": "Jun 24",
      "opponent": "Jose Zaragoza",
      "opponent_id": "864064",
      "opponent_url": "https://boxrec.com/es/box-pro/864064",
      "opponent_record": "9-8-2",
      "recent_form": "WLLLD",
      "result": "W",
      "method": null,
      "rounds": null,
      "venue": "James L. Knight Center, Miami Beach",
      "bout_rating": 1
    },
    {
      "date": "May 24",
      "opponent": "Angel Varela Urena",
      "opponent_id": "1013433",
      "opponent_url": "https://boxrec.com/es/box-pro/1013433",
      "opponent_record": "10-2-0",
      "recent_form": "WWLWLW",
      "result": "W",
      "method": null,
      "rounds": null,
      "venue": "Pechanga Arena, San Diego",
      "bout_rating": 0
    },
    {
      "date": "Mar 24",
      "opponent": "Nelson Hampton",
      "opponent_id": "811601",
      "opponent_url": "https://boxrec.com/es/box-pro/811601",
      "opponent_record": "10-8-0",
      "recent_form": "WWLWLL",
      "result": "W",
      "method": null,
      "rounds": null,
      "venue": "Desert Diamond Arena, Glendale",
      "bout_rating": 1
    },
    {
      "date": "Nov 23",
      "opponent": "Brandon Mendoza",
      "opponent_id": "828910",
      "opponent_url": "https://boxrec.com/es/box-pro/828910",
      "opponent_record": "6-2-0",
      "recent_form": "WWWWLL",
      "result": "W",
      "method": null,
      "rounds": null,
      "venue": "T-Mobile Arena, Las Vegas",
      "bout_rating": 0
    },
    {
      "date": "Sep 23",
      "opponent": "Alejandro Guardado",
      "opponent_id": "1048178",
      "opponent_url": "https://boxrec.com/es/box-pro/1048178",
      "opponent_record": "5-0-0",
      "recent_form": "WWWWW",
      "result": "W",
      "method": null,
      "rounds": null,
      "venue": "American Bank Center, Corpus Christi",
      "bout_rating": 1
    },
    {
      "date": "Aug 23",
      "opponent": "Jorge Luis Marquez Alvarado",
      "opponent_id": "764975",
      "opponent_url": "https://boxrec.com/es/box-pro/764975",
      "opponent_record": "3-5-1",
      "recent_form": "LWDLLL",
      "result": "W",
      "method": null,
      "rounds": null,
      "venue": "Desert Diamond Arena, Glendale",
      "bout_rating": 0
    },
    {
      "date": "May 23",
      "opponent": "Rafael Jasso",
      "opponent_id": "1040411",
      "opponent_url": "https://boxrec.com/es/box-pro/1040411",
      "opponent_record": "3-0-0",
      "recent_form": "WWW",
      "result": "W",
      "method": null,
      "rounds": null,
      "venue": "MGM Grand, Las Vegas",
      "bout_rating": 0
    },
    {
      "date": "Apr 23",
      "opponent": "Edgar Uvalle",
      "opponent_id": "916423",
      "opponent_url": "https://boxrec.com/es/box-pro/916423",
      "opponent_record": "2-3-2",
      "recent_form": "LDLDWW",
      "result": "W",
      "method": null,
      "rounds": null,
      "venue": "Hard Rock Hotel & Casino, Tulsa",
      "bout_rating": 0
    },
    {
      "date": "Feb 23",
      "opponent": "Francisco Duque",
      "opponent_id": "1119747",
      "opponent_url": "https://boxrec.com/es/box-pro/1119747",
      "opponent_record": "1-1-0",
      "recent_form": "LW",
      "result": "W",
      "method": null,
      "rounds": null,
      "venue": "Desert Diamond Arena, Glendale",
      "bout_rating": 1
    },
    {
      "date": "Nov 22",
      "opponent": "Julio Martinez",
      "opponent_id": "1089640",
      "opponent_url": "https://boxrec.com/es/box-pro/1089640",
      "opponent_record": "1-0-0",
      "recent_form": "W",
      "result": "W",
      "method": null,
      "rounds": null,
      "venue": "Palms Casino Resort, Las Vegas",
      "bout_rating": 1
    },
    {
      "date": "May 22",
      "opponent": "Mark Salgado",
      "opponent_id": "1021939",
      "opponent_url": "https://boxrec.com/es/box-pro/1021939",
      "opponent_record": "1-1-0",
      "recent_form": "WL",
      "result": "W",
      "method": null,
      "rounds": null,
      "venue": "Forum, Inglewood",
      "bout_rating": 1
    }
  ]
}