{
  "boxrec_id": "766727",
  "name": "Vergil Ortiz Jr",
  "birth_name": "Vergil Efrain Ortiz II",
  "alias": null,
  "birth_date": null,
  "birth_place": "Dallas, Texas, USA",
  "nationality": "USA",
  "stance": "orthodox",
  "height": "5\u2032 10\u2033 / 178cm",
  "reach": "70\u2033 / 178cm",
  "record": {
    "wins": 23,
    "losses": 0,
    "draws": 0,
    "kos": 0,
    "total_fights": 23
  },
  "division": "super welter",
  "residence": "Grand Prairie, Texas, USA",
  "status": null,
  "career": "2016-2025",
  "debut": "2016-07-30",
  "sex": "male",
  "bouts": [
    {
      "date": "Feb 25",
      "opponent": "Israil Madrimov",
      "result": "W",
      "method": null,
      "rounds": null,
      "venue": "The Venue Riyadh Season, Riyadh"
    },
    {
      "date": "Aug 24",
      "opponent": "Serhii Bohachuk",
      "result": "W",
      "method": null,
      "rounds": null,
      "venue": "Mandalay Bay Resort & Casino, Las Vegas"
    },
    {
      "date": "Apr 24",
      "opponent": "Thomas Dulorme",
      "result": "W",
      "method": null,
      "rounds": null,
      "venue": "Save Mart Arena, Fresno"
    },
    {
      "date": "Jan 24",
      "opponent": "Fredrick Lawson",
      "result": "W",
      "method": null,
      "rounds": null,
      "venue": "Virgin Hotels Las Vegas, Las Vegas"
    },
    {
      "date": "Aug 22",
      "opponent": "Michael McKinson",
      "result": "W",
      "method": null,
      "rounds": null,
      "venue": "Dickies Arena, Fort Worth"
    },
    {
      "date": "Aug 21",
      "opponent": "Egidijus Kavaliauskas",
      "result": "W",
      "method": null,
      "rounds": null,
      "venue": "The Ford Center at The Star, Frisco"
    },
    {
      "date": "Mar 21",
      "opponent": "Maurice Hooker",
      "result": "W",
      "method": null,
      "rounds": null,
      "venue": "Dickies Arena, Fort Worth"
    },
    {
      "date": "Jul 20",
      "opponent": "Samuel Vargas",
      "result": "W",
      "method": null,
      "rounds": null,
      "venue": "Fantasy Springs Casino, Indio"
    },
    {
      "date": "Dec 19",
      "opponent": "Brad Solomon",
      "result": "W",
      "method": null,
      "rounds": null,
      "venue": "Fantasy Springs Casino, Indio"
    },
    {
      "date": "Aug 19",
      "opponent": "Antonio Orozco",
      "result": "W",
      "method": null,
      "rounds": null,
      "venue": "Verizon Theatre, Grand Prairie"
    },
    {
      "date": "May 19",
      "opponent": "Mauricio Herrera",
      "result": "W",
      "method": null,
      "rounds": null,
      "venue": "T-Mobile Arena, Las Vegas"
    },
    {
      "date": "Jan 19",
      "opponent": "Jesus A Valdez Barrayan",
      "result": "W",
      "method": null,
      "rounds": null,
      "venue": "Toyota Center, Houston"
    },
    {
      "date": "Sep 18",
      "opponent": "Roberto Ortiz",
      "result": "W",
      "method": null,
      "rounds": null,
      "venue": "T-Mobile Arena, Las Vegas"
    },
    {
      "date": "Jun 18",
      "opponent": "Juan Salgado Zambrano",
      "result": "W",
      "method": null,
      "rounds": null,
      "venue": "Belasco Theater, Los Angeles"
    },
    {
      "date": "Feb 18",
      "opponent": "Jesus Alvarez Rodriguez",
      "result": "W",
      "method": null,
      "rounds": null,
      "venue": "Fantasy Springs Casino, Indio"
    },
    {
      "date": "Nov 17",
      "opponent": "Evandro Cavalheiro",
      "result": "W",
      "method": null,
      "rounds": null,
      "venue": "Poliforum Benito Juarez, Cancun"
    },
    {
      "date": "Sep 17",
      "opponent": "Cesar Valenzuela",
      "result": "W",
      "method": null,
      "rounds": null,
      "venue": "T-Mobile Arena, Las Vegas"
    },
    {
      "date": "Jun 17",
      "opponent": "Ricardo Alan Fernandez",
      "result": "W",
      "method": null,
      "rounds": null,
      "venue": "Tostitos Championship Plaza, Frisco"
    },
    {
      "date": "May 17",
      "opponent": "Angel Sarinana Rodriguez",
      "result": "W",
      "method": null,
      "rounds": null,
      "venue": "MGM Grand, Grand Garden Arena, Las Vegas"
    },
    {
      "date": "Jan 17",
      "opponent": "Israel Villela",
      "result": "W",
      "method": null,
      "rounds": null,
      "venue": "Fantasy Springs Casino, Indio"
    },
    {
      "date": "Dec 16",
      "opponent": "Nestor Garcia",
      "result": "W",
      "method": null,
      "rounds": null,
      "venue": "Fantasy Springs Casino, Indio"
    },
    {
      "date": "Sep 16",
      "opponent": "Ernesto Hernandez",
      "result": "W",
      "method": null,
      "rounds": null,
      "venue": "AT&T Stadium, Arlington"
    },
    {
      "date": "Jul 16",
      "opponent": "Julio Rodas",
      "result": "W",
      "method": null,
      "rounds": null,
      "venue": "Fantasy Springs Casino, Indio"
    }
  ]
}