{
  "boxrec_id": "851665",
  "name": "Ben Whittaker",
  "birth_name": "Benjamin Whittaker",
  "alias": "'The Surgeon'",
  "birth_date": null,
  "birth_place": "West Bromwich, West Midlands, United Kingdom",
  "nationality": "United Kingdom",
  "stance": "orthodox",
  "height": "6\u2032 3\u2033 / 191cm",
  "reach": null,
  "record": {
    "wins": 9,
    "losses": 0,
    "draws": 1,
    "kos": 0,
    "total_fights": 10
  },
  "division": "light heavy",
  "residence": "West Bromwich, West Midlands, United Kingdom",
  "status": null,
  "career": "2022-2025",
  "debut": "2022-07-30",
  "sex": "male",
  "bouts": [
    {
      "date": "Apr 25",
      "opponent": "Liam Cameron",
      "result": "W",
      "method": null,
      "rounds": null,
      "venue": "bp pulse LIVE Arena, Birmingham"
    },
    {
      "date": "Oct 24",
      "opponent": "Liam Cameron",
      "result": "D",
      "method": null,
      "rounds": null,
      "venue": "Kingdom Arena, Riyadh"
    },
    {
      "date": "Jun 24",
      "opponent": "Eworitse Ezra Arenyeka",
      "result": "W",
      "method": null,
      "rounds": null,
      "venue": "Selhurst Park Football Ground, Crystal Palace"
    },
    {
      "date": "Mar 24",
      "opponent": "Leon Willings",
      "result": "W",
      "method": null,
      "rounds": null,
      "venue": "O2 Arena, Greenwich"
    },
    {
      "date": "Feb 24",
      "opponent": "Khalid Graidia",
      "result": "W",
      "method": null,
      "rounds": null,
      "venue": "Wembley Arena, Wembley"
    },
    {
      "date": "Dec 23",
      "opponent": "Stiven Leonetti Dredhaj",
      "result": "W",
      "method": null,
      "rounds": null,
      "venue": "Bournemouth International Centre, Bournemouth"
    },
    {
      "date": "Jul 23",
      "opponent": "Vladimir Belujsky",
      "result": "W",
      "method": null,
      "rounds": null,
      "venue": "Manchester Arena, Manchester"
    },
    {
      "date": "May 23",
      "opponent": "Jordan Grant",
      "result": "W",
      "method": null,
      "rounds": null,
      "venue": "bp pulse LIVE Arena, Birmingham"
    },
    {
      "date": "Aug 22",
      "opponent": "Petar Nosic",
      "result": "W",
      "method": null,
      "rounds": null,
      "venue": "Jeddah Superdome, Jeddah"
    },
    {
      "date": "Jul 22",
      "opponent": "Greg O'Neill",
      "result": "W",
      "method": null,
      "rounds": null,
      "venue": "Bournemouth International Centre, Bournemouth"
    }
  ]
}