{
  "boxrec_id": "471653",
  "boxrec_url": "https://boxrec.com/en/box-pro/471653",
  "name": "Terrel Williams",
  "slug": "terrel-williams",
  "birth_name": "Terrel Shawn Williams",
  "alias": null,
  "birth_date": null,
  "birth_place": "Inglewood, California, USA",
  "nationality": "USA",
  "stance": "orthodox",
  "height": "6\u2032 0\u2033 / 183cm",
  "reach": "73\u2033 / 185cm",
  "record": {
    "wins": 18,
    "losses": 1,
    "draws": 0,
    "kos": 0,
    "total_fights": 19
  },
  "division": "welter",
  "rating": null,
  "ranking": null,
  "titles": [],
  "bouts_count": 19,
  "rounds_count": 81,
  "ko_percentage": "72.22%",
  "residence": "Los Angeles, California, USA",
  "status": "inactive",
  "career": "2008-2019",
  "debut": "2008-11-13",
  "sex": "male",
  "age": null,
  "company": null,
  "promoter": null,
  "manager_agent": null,
  "wiki": "https://boxrec.com/wiki/index.php?title=Human:471653",
  "bouts": [
    {
      "date": "Sep 19",
      "opponent": "Thomas Dulorme",
      "opponent_id": "462637",
      "opponent_url": "https://boxrec.com/en/box-pro/462637",
      "opponent_record": "24-3-1",
      "recent_form": "WLWWLD",
      "result": "L",
      "method": null,
      "rounds": null,
      "venue": "Rabobank Theater, Bakersfield",
      "bout_rating": 2
    },
    {
      "date": "Apr 19",
      "opponent": "Justin DeLoach",
      "opponent_id": "647963",
      "opponent_url": "https://boxrec.com/en/box-pro/647963",
      "opponent_record": "18-3-0",
      "recent_form": "WWWLLW",
      "result": "W",
      "method": null,
      "rounds": null,
      "venue": "Cosmopolitan of Las Vegas, Las Vegas",
      "bout_rating": 2
    },
    {
      "date": "Sep 18",
      "opponent": "David Grayton",
      "opponent_id": "622345",
      "opponent_url": "https://boxrec.com/en/box-pro/622345",
      "opponent_record": "15-2-1",
      "recent_form": "WWLWDL",
      "result": "W",
      "method": null,
      "rounds": null,
      "venue": "2300 Arena, Philadelphia",
      "bout_rating": 1
    },
    {
      "date": "Nov 17",
      "opponent": "Rosemberg Gomez",
      "opponent_id": "295339",
      "opponent_url": "https://boxrec.com/en/box-pro/295339",
      "opponent_record": "19-6-1",
      "recent_form": "LWLWWL",
      "result": "W",
      "method": null,
      "rounds": null,
      "venue": "Dort Financial Center, Flint",
      "bout_rating": 1
    },
    {
      "date": "Oct 15",
      "opponent": "Prichard Colon",
      "opponent_id": "642596",
      "opponent_url": "https://boxrec.com/en/box-pro/642596",
      "opponent_record": "16-0-0",
      "recent_form": "WWWWWW",
      "result": "W",
      "method": null,
      "rounds": null,
      "venue": "EagleBank Arena, Fairfax",
      "bout_rating": 2
    },
    {
      "date": "Aug 15",
      "opponent": "John Williams",
      "opponent_id": "463355",
      "opponent_url": "https://boxrec.com/en/box-pro/463355",
      "opponent_record": "15-3-1",
      "recent_form": "WLWWWW",
      "result": "W",
      "method": null,
      "rounds": null,
      "venue": "The Hangar, Costa Mesa",
      "bout_rating": 1
    },
    {
      "date": "May 15",
      "opponent": "Tavorus Teague",
      "opponent_id": "685218",
      "opponent_url": "https://boxrec.com/en/box-pro/685218",
      "opponent_record": "2-3-1",
      "recent_form": "WWLDLL",
      "result": "W",
      "method": null,
      "rounds": null,
      "venue": "Hotel Irvine, Irvine",
      "bout_rating": 0
    },
    {
      "date": "Jun 13",
      "opponent": "Bernardo Guereca",
      "opponent_id": "42084",
      "opponent_url": "https://boxrec.com/en/box-pro/42084",
      "opponent_record": "17-18-1",
      "recent_form": "LLLLWL",
      "result": "W",
      "method": null,
      "rounds": null,
      "venue": "Quiet Cannon, Montebello",
      "bout_rating": 0
    },
    {
      "date": "May 13",
      "opponent": "Devarise Crayton",
      "opponent_id": "375603",
      "opponent_url": "https://boxrec.com/en/box-pro/375603",
      "opponent_record": "7-14-2",
      "recent_form": "LLWLLL",
      "result": "W",
      "method": null,
      "rounds": null,
      "venue": "Santa Monica Pier, Santa Monica",
      "bout_rating": 0
    },
    {
      "date": "Mar 13",
      "opponent": "Luis Alfredo Lugo",
      "opponent_id": "321986",
      "opponent_url": "https://boxrec.com/en/box-pro/321986",
      "opponent_record": "13-17-1",
      "recent_form": "LLLWLW",
      "result": "W",
      "method": null,
      "rounds": null,
      "venue": "Florentine Gardens, Hollywood",
      "bout_rating": 0
    },
    {
      "date": "Feb 13",
      "opponent": "Omar Avelar",
      "opponent_id": "553060",
      "opponent_url": "https://boxrec.com/en/box-pro/553060",
      "opponent_record": "2-4-0",
      "recent_form": "LLLWWL",
      "result": "W",
      "method": null,
      "rounds": null,
      "venue": "Jonathan Club, Los Angeles",
      "bout_rating": 0
    },
    {
      "date": "Nov 12",
      "opponent": "Marqus Jackson",
      "opponent_id": "452258",
      "opponent_url": "https://boxrec.com/en/box-pro/452258",
      "opponent_record": "2-8-0",
      "recent_form": "LLLLLL",
      "result": "W",
      "method": null,
      "rounds": null,
      "venue": "Westin Bonaventure Hotel, Los Angeles",
      "bout_rating": 0
    },
    {
      "date": "Sep 12",
      "opponent": "Lawrence Hughes",
      "opponent_id": "493365",
      "opponent_url": "https://boxrec.com/en/box-pro/493365",
      "opponent_record": "4-4-0",
      "recent_form": "WWLLLL",
      "result": "W",
      "method": null,
      "rounds": null,
      "venue": "Florentine Gardens, Hollywood",
      "bout_rating": 0
    },
    {
      "date": "Aug 12",
      "opponent": "Jeremiah Torres",
      "opponent_id": "44487",
      "opponent_url": "https://boxrec.com/en/box-pro/44487",
      "opponent_record": "7-18-0",
      "recent_form": "LLLLLL",
      "result": "W",
      "method": null,
      "rounds": null,
      "venue": "Westin Bonaventure Hotel, Los Angeles",
      "bout_rating": 0
    },
    {
      "date": "Jul 12",
      "opponent": "Clifford McPherson",
      "opponent_id": "327502",
      "opponent_url": "https://boxrec.com/en/box-pro/327502",
      "opponent_record": "2-9-1",
      "recent_form": "LLLLLL",
      "result": "W",
      "method": null,
      "rounds": null,
      "venue": "Florentine Gardens, Hollywood",
      "bout_rating": 0
    },
    {
      "date": "Sep 11",
      "opponent": "Andre Ewell",
      "opponent_id": "584747",
      "opponent_url": "https://boxrec.com/en/box-pro/584747",
      "opponent_record": null,
      "recent_form": null,
      "result": "W",
      "method": null,
      "rounds": null,
      "venue": "Hollywood Park Casino, Inglewood",
      "bout_rating": 0
    },
    {
      "date": "Oct 09",
      "opponent": "Juan Zamarripa",
      "opponent_id": "441486",
      "opponent_url": "https://boxrec.com/en/box-pro/441486",
      "opponent_record": "0-1-0",
      "recent_form": "L",
      "result": "W",
      "method": null,
      "rounds": null,
      "venue": "Celebrity Theater, Phoenix",
      "bout_rating": 0
    },
    {
      "date": "Sep 09",
      "opponent": "Joshua Zurfluh",
      "opponent_id": "74054",
      "opponent_url": "https://boxrec.com/en/box-pro/74054",
      "opponent_record": "1-6-1",
      "recent_form": "WLLLLL",
      "result": "W",
      "method": null,
      "rounds": null,
      "venue": "Pechanga Resort & Casino, Temecula",
      "bout_rating": 0
    },
    {
      "date": "Nov 08",
      "opponent": "Raymundo Ortega",
      "opponent_id": "432232",
      "opponent_url": "https://boxrec.com/en/box-pro/432232",
      "opponent_record": "1-4-0",
      "recent_form": "LWLLL",
      "result": "W",
      "method": null,
      "rounds": null,
      "venue": "Expo Center, El Monte",
      "bout_rating": 0
    }
  ]
}