{
  "boxrec_id": "718399",
  "name": "Brandon Figueroa",
  "birth_name": "Brandon Lee Figueroa",
  "alias": "The Heartbreaker",
  "birth_date": null,
  "birth_place": "Weslaco, Texas, USA",
  "nationality": "USA",
  "stance": "orthodox",
  "height": "5\u2032 9\u2033 / 175cm",
  "reach": "72\u00bd\u2033 / 184cm",
  "record": {
    "wins": 26,
    "losses": 2,
    "draws": 1,
    "kos": 0,
    "total_fights": 29
  },
  "division": "feather",
  "residence": "Weslaco, Texas, USA",
  "status": null,
  "career": "2015-2025",
  "debut": "2015-05-09",
  "sex": "male",
  "bouts": [
    {
      "date": "2025-07-19",
      "opponent": "Joet Gonzalez",
      "result": "W",
      "method": null,
      "rounds": null,
      "venue": "MGM Grand, Grand Garden Arena, Las Vegas"
    },
    {
      "date": "Feb 25",
      "opponent": "Stephen Fulton",
      "result": "L",
      "method": null,
      "rounds": null,
      "venue": "T-Mobile Arena, Las Vegas"
    },
    {
      "date": "May 24",
      "opponent": "Jessie Magdaleno",
      "result": "W",
      "method": null,
      "rounds": null,
      "venue": "T-Mobile Arena, Las Vegas"
    },
    {
      "date": "Mar 23",
      "opponent": "Mark Magsayo",
      "result": "W",
      "method": null,
      "rounds": null,
      "venue": "Toyota Arena, Ontario"
    },
    {
      "date": "Jul 22",
      "opponent": "Carlos Castro",
      "result": "W",
      "method": null,
      "rounds": null,
      "venue": "Alamodome, San Antonio"
    },
    {
      "date": "Nov 21",
      "opponent": "Stephen Fulton",
      "result": "L",
      "method": null,
      "rounds": null,
      "venue": "Park Theater, Las Vegas"
    },
    {
      "date": "May 21",
      "opponent": "Luis Nery",
      "result": "W",
      "method": null,
      "rounds": null,
      "venue": "Dignity Health Sports Park, Carson"
    },
    {
      "date": "Sep 20",
      "opponent": "Damien Vazquez",
      "result": "W",
      "method": null,
      "rounds": null,
      "venue": "Mohegan Sun Casino, Uncasville"
    },
    {
      "date": "Nov 19",
      "opponent": "Julio Ceja",
      "result": "D",
      "method": null,
      "rounds": null,
      "venue": "MGM Grand, Grand Garden Arena, Las Vegas"
    },
    {
      "date": "Aug 19",
      "opponent": "Javier Nicolas Chacon",
      "result": "W",
      "method": null,
      "rounds": null,
      "venue": "Bert Ogden Arena, Edinburg"
    },
    {
      "date": "Apr 19",
      "opponent": "Yonfrez Parejo",
      "result": "W",
      "method": null,
      "rounds": null,
      "venue": "Dignity Health Sports Park, Carson"
    },
    {
      "date": "Jan 19",
      "opponent": "Moises Flores",
      "result": "W",
      "method": null,
      "rounds": null,
      "venue": "Microsoft Theater, Los Angeles"
    },
    {
      "date": "Sep 18",
      "opponent": "Oscar Escandon",
      "result": "W",
      "method": null,
      "rounds": null,
      "venue": "Citizens Business Bank Arena, Ontario"
    },
    {
      "date": "Aug 18",
      "opponent": "Luis Roy Suarez Cruz",
      "result": "W",
      "method": null,
      "rounds": null,
      "venue": "Nassau Coliseum, Uniondale"
    },
    {
      "date": "Mar 18",
      "opponent": "Giovanni Delgado Morales",
      "result": "W",
      "method": null,
      "rounds": null,
      "venue": "Freeman Coliseum, San Antonio"
    },
    {
      "date": "Oct 17",
      "opponent": "Victor Proa",
      "result": "W",
      "method": null,
      "rounds": null,
      "venue": "Livestock Showground, Mercedes"
    },
    {
      "date": "Jul 17",
      "opponent": "Fatiou Fassinou",
      "result": "W",
      "method": null,
      "rounds": null,
      "venue": "Nassau Coliseum, Uniondale"
    },
    {
      "date": "May 17",
      "opponent": "Luis Fernando Saavedra",
      "result": "W",
      "method": null,
      "rounds": null,
      "venue": "Sportsmans Lodge, Studio City, Los Angeles"
    },
    {
      "date": "Feb 17",
      "opponent": "Raul Chirino",
      "result": "W",
      "method": null,
      "rounds": null,
      "venue": "Silver Street Studios, Houston"
    },
    {
      "date": "Oct 16",
      "opponent": "Raymond Chacon*",
      "result": "W",
      "method": null,
      "rounds": null,
      "venue": "Sports Arena, Brownsville"
    },
    {
      "date": "Jul 16",
      "opponent": "Adalberto Zorrilla DelRosa",
      "result": "W",
      "method": null,
      "rounds": null,
      "venue": "Scottish Rite Theatre, San Antonio"
    },
    {
      "date": "Jun 16",
      "opponent": "Oldier Landin",
      "result": "W",
      "method": null,
      "rounds": null,
      "venue": "Scottish Rite Theatre, San Antonio"
    },
    {
      "date": "May 16",
      "opponent": "Jonell Nieves",
      "result": "W",
      "method": null,
      "rounds": null,
      "venue": "Cowboys Dance Hall, San Antonio"
    },
    {
      "date": "Apr 16",
      "opponent": "Jahaziel Vazquez",
      "result": "W",
      "method": null,
      "rounds": null,
      "venue": "Events Center, Pharr"
    },
    {
      "date": "Jan 16",
      "opponent": "Harold Reyes",
      "result": "W",
      "method": null,
      "rounds": null,
      "venue": "Cowboys Dance Hall, San Antonio"
    },
    {
      "date": "Dec 15",
      "opponent": "Francisco Muro",
      "result": "W",
      "method": null,
      "rounds": null,
      "venue": "AT&T Center, San Antonio"
    },
    {
      "date": "Oct 15",
      "opponent": "Ramiro Ruiz",
      "result": "W",
      "method": null,
      "rounds": null,
      "venue": "Boggus Ford Center, Pharr"
    },
    {
      "date": "Jun 15",
      "opponent": "Ricardo Mena",
      "result": "W",
      "method": null,
      "rounds": null,
      "venue": "State Farm Arena, Hidalgo"
    },
    {
      "date": "May 15",
      "opponent": "Hector Gutierrez",
      "result": "W",
      "method": null,
      "rounds": null,
      "venue": "State Farm Arena, Hidalgo"
    }
  ]
}