{
  "boxrec_id": "749669",
  "name": "Subriel Matias",
  "birth_name": "Subriel Ahmed Mat\u00edas Matthew",
  "alias": "El Orgullo de Maternillo",
  "birth_date": null,
  "birth_place": "Fajardo, Puerto Rico",
  "nationality": "Puerto Rico",
  "stance": "orthodox",
  "height": "5\u2032 8\u2033 / 173cm",
  "reach": "71\u2033 / 180cm",
  "record": {
    "wins": 23,
    "losses": 2,
    "draws": 0,
    "kos": 0,
    "total_fights": 25
  },
  "division": "super light",
  "residence": "Fajardo, Puerto Rico",
  "status": null,
  "career": "2015-2025",
  "debut": "2015-12-19",
  "sex": "male",
  "bouts": [
    {
      "date": "2025-07-12",
      "opponent": "Alberto Puello",
      "result": "W",
      "method": null,
      "rounds": null,
      "venue": "Louis Armstrong Stadium, Queens"
    },
    {
      "date": "Mar 25",
      "opponent": "Gabriel Gollaz Valenzuela",
      "result": "W",
      "method": null,
      "rounds": null,
      "venue": "Coliseo Tomas Dones, Fajardo"
    },
    {
      "date": "Nov 24",
      "opponent": "Roberto Ramirez",
      "result": "W",
      "method": null,
      "rounds": null,
      "venue": "Coliseo Ruben Rodriguez, Bayamon"
    },
    {
      "date": "Jun 24",
      "opponent": "Liam Paro",
      "result": "L",
      "method": null,
      "rounds": null,
      "venue": "Coliseo Juan Aubin Cruz Abreu, Manati"
    },
    {
      "date": "Nov 23",
      "opponent": "Shohjahon Ergashev",
      "result": "W",
      "method": null,
      "rounds": null,
      "venue": "Michelob Ultra Arena, Las Vegas"
    },
    {
      "date": "Feb 23",
      "opponent": "Jeremias Nicolas Ponce",
      "result": "W",
      "method": null,
      "rounds": null,
      "venue": "Armory, Minneapolis"
    },
    {
      "date": "Jan 22",
      "opponent": "Petros Ananyan",
      "result": "W",
      "method": null,
      "rounds": null,
      "venue": "Borgata Hotel Casino, Atlantic City"
    },
    {
      "date": "May 21",
      "opponent": "Batyrzhan Jukembayev",
      "result": "W",
      "method": null,
      "rounds": null,
      "venue": "Dignity Health Sports Park, Carson"
    },
    {
      "date": "Oct 20",
      "opponent": "Malik Hawkins",
      "result": "W",
      "method": null,
      "rounds": null,
      "venue": "Mohegan Sun Casino, Uncasville"
    },
    {
      "date": "Feb 20",
      "opponent": "Petros Ananyan",
      "result": "L",
      "method": null,
      "rounds": null,
      "venue": "MGM Grand, Grand Garden Arena, Las Vegas"
    },
    {
      "date": "Nov 19",
      "opponent": "Jonathan Jose Eniz*",
      "result": "W",
      "method": null,
      "rounds": null,
      "venue": "Coliseo Tomas Dones, Fajardo"
    },
    {
      "date": "Jul 19",
      "opponent": "Maxim Dadashev",
      "result": "W",
      "method": null,
      "rounds": null,
      "venue": "MGM National Harbor, Oxon Hill"
    },
    {
      "date": "Mar 19",
      "opponent": "Wilberth Lopez",
      "result": "W",
      "method": null,
      "rounds": null,
      "venue": "Coliseo Tomas Dones, Fajardo"
    },
    {
      "date": "Oct 18",
      "opponent": "Fernando David Saucedo",
      "result": "W",
      "method": null,
      "rounds": null,
      "venue": "Lakefront Arena, New Orleans"
    },
    {
      "date": "Aug 18",
      "opponent": "Breidis Prescott",
      "result": "W",
      "method": null,
      "rounds": null,
      "venue": "Coliseo Tomas Dones, Fajardo"
    },
    {
      "date": "May 18",
      "opponent": "Adrian Estrella",
      "result": "W",
      "method": null,
      "rounds": null,
      "venue": "Parque de Pelota Pedro \"Perucho\" Cepeda, Catano"
    },
    {
      "date": "Feb 18",
      "opponent": "Daulis Prescott",
      "result": "W",
      "method": null,
      "rounds": null,
      "venue": "Coliseo Ecuestre Municipal, Fajardo"
    },
    {
      "date": "Nov 17",
      "opponent": "Patrick Lopez",
      "result": "W",
      "method": null,
      "rounds": null,
      "venue": "Hotel Jaragua, Santo Domingo"
    },
    {
      "date": "Aug 17",
      "opponent": "Luis Alberto Pelayo",
      "result": "W",
      "method": null,
      "rounds": null,
      "venue": "Coliseo Ecuestre Municipal, Fajardo"
    },
    {
      "date": "Jun 17",
      "opponent": "Abrahan Peralta",
      "result": "W",
      "method": null,
      "rounds": null,
      "venue": "Hotel Jaragua, Santo Domingo"
    },
    {
      "date": "Mar 17",
      "opponent": "Joaquim Carneiro",
      "result": "W",
      "method": null,
      "rounds": null,
      "venue": "Parque Concepcion Perez Alberto, Fajardo"
    },
    {
      "date": "Dec 16",
      "opponent": "Jeffrey Fontanez",
      "result": "W",
      "method": null,
      "rounds": null,
      "venue": "Coliseo Cosme Beitia Salamo, Catano"
    },
    {
      "date": "Sep 16",
      "opponent": "Luis Rodriguez",
      "result": "W",
      "method": null,
      "rounds": null,
      "venue": "Coliseo Cosme Beitia Salamo, Catano"
    },
    {
      "date": "Jul 16",
      "opponent": "Ramon Melendez",
      "result": "W",
      "method": null,
      "rounds": null,
      "venue": "Coliseo Tomas Dones, Fajardo"
    },
    {
      "date": "Dec 15",
      "opponent": "Juan Rojas Rodriguez",
      "result": "W",
      "method": null,
      "rounds": null,
      "venue": "Coliseo Tomas Dones, Fajardo"
    }
  ]
}