{
  "boxrec_id": "659771",
  "boxrec_url": "https://boxrec.com/en/box-pro/659771",
  "name": "Vasyl Lomachenko",
  "slug": "vasyl-lomachenko",
  "birth_name": "Vasyl Anatoliyovich Lomachenko",
  "alias": "Loma, Hi-Tech, The Matrix",
  "birth_date": null,
  "birth_place": "Bilhorod-Dnistrovskyi, Ukraine",
  "nationality": "Ukraine",
  "stance": "southpaw",
  "height": "5\u2032 7\u2033 / 170cm",
  "reach": "65\u00bd\u2033 / 166cm",
  "record": {
    "wins": 18,
    "losses": 3,
    "draws": 0,
    "kos": 0,
    "total_fights": 21
  },
  "division": "light",
  "rating": null,
  "ranking": null,
  "titles": [
    "IBF World Light"
  ],
  "bouts_count": 21,
  "rounds_count": 199,
  "ko_percentage": "66.67%",
  "residence": "Oxnard, California, USA",
  "status": "inactive",
  "career": "2013-2024",
  "debut": "2013-10-12",
  "sex": "male",
  "age": null,
  "company": null,
  "promoter": null,
  "manager_agent": "Egis Klimas",
  "wiki": "https://boxrec.com/wiki/index.php?title=Human:659771",
  "bouts": [
    {
      "date": "May 24",
      "opponent": "George Kambosos Jr",
      "opponent_id": "646781",
      "opponent_url": "https://boxrec.com/en/box-pro/646781",
      "opponent_record": "21-2-0",
      "recent_form": "WWWLLW",
      "result": "W",
      "method": null,
      "rounds": null,
      "venue": "RAC Arena, Perth",
      "bout_rating": 3
    },
    {
      "date": "May 23",
      "opponent": "Devin Haney",
      "opponent_id": "741718",
      "opponent_url": "https://boxrec.com/en/box-pro/741718",
      "opponent_record": "29-0-0",
      "recent_form": "WWWWWW",
      "result": "L",
      "method": null,
      "rounds": null,
      "venue": "MGM Grand, Las Vegas",
      "bout_rating": 5
    },
    {
      "date": "Oct 22",
      "opponent": "Jamaine Ortiz",
      "opponent_id": "755909",
      "opponent_url": "https://boxrec.com/en/box-pro/755909",
      "opponent_record": "16-0-1",
      "recent_form": "WWWDWW",
      "result": "W",
      "method": null,
      "rounds": null,
      "venue": "Madison Square Garden Theater, New York",
      "bout_rating": 4
    },
    {
      "date": "Dec 21",
      "opponent": "Richard Commey",
      "opponent_id": "563751",
      "opponent_url": "https://boxrec.com/en/box-pro/563751",
      "opponent_record": "30-3-0",
      "recent_form": "WWWWLW",
      "result": "W",
      "method": null,
      "rounds": null,
      "venue": "Madison Square Garden, New York",
      "bout_rating": 3
    },
    {
      "date": "Jun 21",
      "opponent": "Masayoshi Nakatani",
      "opponent_id": "573607",
      "opponent_url": "https://boxrec.com/en/box-pro/573607",
      "opponent_record": "19-1-0",
      "recent_form": "WWWWLW",
      "result": "W",
      "method": null,
      "rounds": null,
      "venue": "Virgin Hotels Las Vegas, Las Vegas",
      "bout_rating": 3
    },
    {
      "date": "Oct 20",
      "opponent": "Teofimo Lopez",
      "opponent_id": "776269",
      "opponent_url": "https://boxrec.com/en/box-pro/776269",
      "opponent_record": "15-0-0",
      "recent_form": "WWWWWW",
      "result": "L",
      "method": null,
      "rounds": null,
      "venue": "The Bubble, MGM Grand, Las Vegas",
      "bout_rating": 5
    },
    {
      "date": "Aug 19",
      "opponent": "Luke Campbell",
      "opponent_id": "651514",
      "opponent_url": "https://boxrec.com/en/box-pro/651514",
      "opponent_record": "20-2-0",
      "recent_form": "WWLWWW",
      "result": "W",
      "method": null,
      "rounds": null,
      "venue": "O2 Arena, Greenwich",
      "bout_rating": 3
    },
    {
      "date": "Apr 19",
      "opponent": "Anthony Crolla",
      "opponent_id": "371746",
      "opponent_url": "https://boxrec.com/en/box-pro/371746",
      "opponent_record": "34-6-3",
      "recent_form": "WLLWWW",
      "result": "W",
      "method": null,
      "rounds": null,
      "venue": "Staples Center, Los Angeles",
      "bout_rating": 4
    },
    {
      "date": "Dec 18",
      "opponent": "Jose Pedraza",
      "opponent_id": "559909",
      "opponent_url": "https://boxrec.com/en/box-pro/559909",
      "opponent_record": "25-1-0",
      "recent_form": "WWLWWW",
      "result": "W",
      "method": null,
      "rounds": null,
      "venue": "Madison Square Garden Theater, New York",
      "bout_rating": 4
    },
    {
      "date": "May 18",
      "opponent": "Jorge Linares",
      "opponent_id": "157610",
      "opponent_url": "https://boxrec.com/en/box-pro/157610",
      "opponent_record": "44-3-0",
      "recent_form": "WWWWWW",
      "result": "W",
      "method": null,
      "rounds": null,
      "venue": "Madison Square Garden, New York",
      "bout_rating": 4
    },
    {
      "date": "Dec 17",
      "opponent": "Guillermo Rigondeaux",
      "opponent_id": "492989",
      "opponent_url": "https://boxrec.com/en/box-pro/492989",
      "opponent_record": "17-0-0",
      "recent_form": "WWWWW",
      "result": "W",
      "method": null,
      "rounds": null,
      "venue": "Madison Square Garden Theater, New York",
      "bout_rating": 4
    },
    {
      "date": "Aug 17",
      "opponent": "Miguel Marriaga",
      "opponent_id": "501289",
      "opponent_url": "https://boxrec.com/en/box-pro/501289",
      "opponent_record": "25-2-0",
      "recent_form": "WWWWWL",
      "result": "W",
      "method": null,
      "rounds": null,
      "venue": "Microsoft Theater, Los Angeles",
      "bout_rating": 3
    },
    {
      "date": "Apr 17",
      "opponent": "Jason Sosa",
      "opponent_id": "516570",
      "opponent_url": "https://boxrec.com/en/box-pro/516570",
      "opponent_record": "20-1-4",
      "recent_form": "WWWDWW",
      "result": "W",
      "method": null,
      "rounds": null,
      "venue": "MGM National Harbor, Oxon Hill",
      "bout_rating": 3
    },
    {
      "date": "Nov 16",
      "opponent": "Nicholas Walters",
      "opponent_id": "462974",
      "opponent_url": "https://boxrec.com/en/box-pro/462974",
      "opponent_record": "26-0-1",
      "recent_form": "WWWWWD",
      "result": "W",
      "method": null,
      "rounds": null,
      "venue": "Cosmopolitan of Las Vegas, Las Vegas",
      "bout_rating": 4
    },
    {
      "date": "Jun 16",
      "opponent": "Roman Martinez",
      "opponent_id": "93555",
      "opponent_url": "https://boxrec.com/en/box-pro/93555",
      "opponent_record": "29-2-3",
      "recent_form": "DWLWWD",
      "result": "W",
      "method": null,
      "rounds": null,
      "venue": "Madison Square Garden Theater, New York",
      "bout_rating": 2
    },
    {
      "date": "Nov 15",
      "opponent": "Romulo Koasicha",
      "opponent_id": "483880",
      "opponent_url": "https://boxrec.com/en/box-pro/483880",
      "opponent_record": "25-4-0",
      "recent_form": "WLWWWW",
      "result": "W",
      "method": null,
      "rounds": null,
      "venue": "Thomas & Mack Center, Las Vegas",
      "bout_rating": 2
    },
    {
      "date": "May 15",
      "opponent": "Gamalier Rodriguez",
      "opponent_id": "349083",
      "opponent_url": "https://boxrec.com/en/box-pro/349083",
      "opponent_record": "25-2-3",
      "recent_form": "WWWWWW",
      "result": "W",
      "method": null,
      "rounds": null,
      "venue": "MGM Grand, Grand Garden Arena, Las Vegas",
      "bout_rating": 2
    },
    {
      "date": "Nov 14",
      "opponent": "Suriya Tatakhun",
      "opponent_id": "233591",
      "opponent_url": "https://boxrec.com/en/box-pro/233591",
      "opponent_record": "51-1-0",
      "recent_form": "WWWWWW",
      "result": "W",
      "method": null,
      "rounds": null,
      "venue": "Cotai Arena, Venetian Resort, Macao",
      "bout_rating": 3
    },
    {
      "date": "Jun 14",
      "opponent": "Gary Allen Russell Jr",
      "opponent_id": "479775",
      "opponent_url": "https://boxrec.com/en/box-pro/479775",
      "opponent_record": "24-0-0",
      "recent_form": "WWWWWW",
      "result": "W",
      "method": null,
      "rounds": null,
      "venue": "StubHub Center, Carson",
      "bout_rating": 4
    },
    {
      "date": "Mar 14",
      "opponent": "Orlando Salido",
      "opponent_id": "43998",
      "opponent_url": "https://boxrec.com/en/box-pro/43998",
      "opponent_record": "41-12-2",
      "recent_form": "WWWWLW",
      "result": "L",
      "method": null,
      "rounds": null,
      "venue": "Alamodome, San Antonio",
      "bout_rating": 4
    },
    {
      "date": "Oct 13",
      "opponent": "Jose Luis Ramirez",
      "opponent_id": "346120",
      "opponent_url": "https://boxrec.com/en/box-pro/346120",
      "opponent_record": "25-3-0",
      "recent_form": "WWLWWW",
      "result": "W",
      "method": null,
      "rounds": null,
      "venue": "Thomas & Mack Center, Las Vegas",
      "bout_rating": 1
    }
  ]
}