{
  "boxrec_id": "779719",
  "boxrec_url": "https://boxrec.com/en/box-pro/779719",
  "name": "William Scull",
  "slug": "william-scull",
  "birth_name": "William Scull Yero",
  "alias": "El Indomable",
  "birth_date": null,
  "birth_place": "Matanzas, Cuba",
  "nationality": "Cuba",
  "stance": "orthodox",
  "height": "5\u2032 11\u00bd\u2033 / 182cm",
  "reach": null,
  "record": {
    "wins": 23,
    "losses": 1,
    "draws": 0,
    "kos": 0,
    "total_fights": 24
  },
  "division": "super middle",
  "rating": "",
  "ranking": null,
  "titles": [],
  "bouts_count": 24,
  "rounds_count": 156,
  "ko_percentage": "39.13%",
  "residence": "Berlin, Germany",
  "status": null,
  "career": "2016-2025",
  "debut": "2016-11-11",
  "sex": "male",
  "age": null,
  "company": null,
  "promoter": null,
  "manager_agent": null,
  "wiki": "https://boxrec.com/wiki/index.php?title=Human:779719",
  "bouts": [
    {
      "date": "May 25",
      "opponent": "Saul Alvarez",
      "opponent_id": "348759",
      "opponent_url": "https://boxrec.com/en/box-pro/348759",
      "opponent_record": "62-2-2",
      "recent_form": "LWWWWW",
      "result": "L",
      "method": null,
      "rounds": null,
      "venue": "The Venue Riyadh Season, Riyadh",
      "bout_rating": 4
    },
    {
      "date": "Oct 24",
      "opponent": "Vladimir Shishkin",
      "opponent_id": "767596",
      "opponent_url": "https://boxrec.com/en/box-pro/767596",
      "opponent_record": "16-0-0",
      "recent_form": "WWWWWW",
      "result": "W",
      "method": null,
      "rounds": null,
      "venue": "Stadthalle, Falkensee",
      "bout_rating": 3
    },
    {
      "date": "May 24",
      "opponent": "Sean Hemphill",
      "opponent_id": "860317",
      "opponent_url": "https://boxrec.com/en/box-pro/860317",
      "opponent_record": "16-1-0",
      "recent_form": "WWWLWW",
      "result": "W",
      "method": null,
      "rounds": null,
      "venue": "T-Mobile Arena, Las Vegas",
      "bout_rating": 2
    },
    {
      "date": "Oct 23",
      "opponent": "Cristian Fabian Rios",
      "opponent_id": "445347",
      "opponent_url": "https://boxrec.com/en/box-pro/445347",
      "opponent_record": "23-18-3",
      "recent_form": "WLLLLL",
      "result": "W",
      "method": null,
      "rounds": null,
      "venue": "Stadthalle, Falkensee",
      "bout_rating": 0
    },
    {
      "date": "Nov 22",
      "opponent": "Abel Nicolas Adriel",
      "opponent_id": "524701",
      "opponent_url": "https://boxrec.com/en/box-pro/524701",
      "opponent_record": "26-25-3",
      "recent_form": "WWLLWL",
      "result": "W",
      "method": null,
      "rounds": null,
      "venue": "AGON Sportpark, Charlottenburg",
      "bout_rating": 0
    },
    {
      "date": "Jul 22",
      "opponent": "Evgeny Shvedenko",
      "opponent_id": "737983",
      "opponent_url": "https://boxrec.com/en/box-pro/737983",
      "opponent_record": "15-0-0",
      "recent_form": "WWWWWW",
      "result": "W",
      "method": null,
      "rounds": null,
      "venue": "Stadtwerke Arena, Erding",
      "bout_rating": 2
    },
    {
      "date": "Nov 21",
      "opponent": "Deneb Diaz",
      "opponent_id": "824428",
      "opponent_url": "https://boxrec.com/en/box-pro/824428",
      "opponent_record": "16-1-0",
      "recent_form": "WWLWW",
      "result": "W",
      "method": null,
      "rounds": null,
      "venue": "AGON Sportpark, Charlottenburg",
      "bout_rating": 1
    },
    {
      "date": "May 21",
      "opponent": "Dragan Lepei",
      "opponent_id": "669872",
      "opponent_url": "https://boxrec.com/en/box-pro/669872",
      "opponent_record": "19-3-2",
      "recent_form": "WLWWWL",
      "result": "W",
      "method": null,
      "rounds": null,
      "venue": "AGON Sportpark, Charlottenburg",
      "bout_rating": 1
    },
    {
      "date": "Feb 21",
      "opponent": "Gino Kanters",
      "opponent_id": "732941",
      "opponent_url": "https://boxrec.com/en/box-pro/732941",
      "opponent_record": "8-3-2",
      "recent_form": "DWWLWD",
      "result": "W",
      "method": null,
      "rounds": null,
      "venue": "AGON Sportpark, Charlottenburg",
      "bout_rating": 1
    },
    {
      "date": "Aug 20",
      "opponent": "Mathias Eklund",
      "opponent_id": "711500",
      "opponent_url": "https://boxrec.com/en/box-pro/711500",
      "opponent_record": "12-3-2",
      "recent_form": "LDLWLW",
      "result": "W",
      "method": null,
      "rounds": null,
      "venue": "Havelstudios, Charlottenburg",
      "bout_rating": 0
    },
    {
      "date": "Sep 19",
      "opponent": "Siarhei Khamitski",
      "opponent_id": "214262",
      "opponent_url": "https://boxrec.com/en/box-pro/214262",
      "opponent_record": "32-18-3",
      "recent_form": "LLLWLL",
      "result": "W",
      "method": null,
      "rounds": null,
      "venue": "Sporthalle, Zinnowitz",
      "bout_rating": 1
    },
    {
      "date": "Jul 19",
      "opponent": "Sebastian Horacio Papeschi",
      "opponent_id": "707760",
      "opponent_url": "https://boxrec.com/en/box-pro/707760",
      "opponent_record": "14-1-0",
      "recent_form": "WWWLWW",
      "result": "W",
      "method": null,
      "rounds": null,
      "venue": "Complejo Deportivo Teniente Origone, Justiniano Posse",
      "bout_rating": 2
    },
    {
      "date": "Jun 19",
      "opponent": "Roman Shkarupa",
      "opponent_id": "228205",
      "opponent_url": "https://boxrec.com/en/box-pro/228205",
      "opponent_record": "28-9-2",
      "recent_form": "LLLWLL",
      "result": "W",
      "method": null,
      "rounds": null,
      "venue": "Sport and Congress Center, Schwerin",
      "bout_rating": 1
    },
    {
      "date": "Mar 19",
      "opponent": "Basilio Silva",
      "opponent_id": "572663",
      "opponent_url": "https://boxrec.com/en/box-pro/572663",
      "opponent_record": "24-16-0",
      "recent_form": "WWWLLL",
      "result": "W",
      "method": null,
      "rounds": null,
      "venue": "Club Atletico Racing, Trelew",
      "bout_rating": 0
    },
    {
      "date": "Nov 18",
      "opponent": "Ivan Sakic",
      "opponent_id": "654184",
      "opponent_url": "https://boxrec.com/en/box-pro/654184",
      "opponent_record": "1-27-0",
      "recent_form": "LLLLLL",
      "result": "W",
      "method": null,
      "rounds": null,
      "venue": "Sporthalle Zur Kuhdrift 1, Neustadt Glewe",
      "bout_rating": 0
    },
    {
      "date": "Aug 18",
      "opponent": "Jose Luis Yana",
      "opponent_id": "790203",
      "opponent_url": "https://boxrec.com/en/box-pro/790203",
      "opponent_record": "7-2-0",
      "recent_form": "WWWWLL",
      "result": "W",
      "method": null,
      "rounds": null,
      "venue": "Gimnasio H\u00e9roes de Malvinas, Playa Union",
      "bout_rating": 0
    },
    {
      "date": "May 18",
      "opponent": "Martin Fidel Rios",
      "opponent_id": "636738",
      "opponent_url": "https://boxrec.com/en/box-pro/636738",
      "opponent_record": "22-16-4",
      "recent_form": "WLLLLL",
      "result": "W",
      "method": null,
      "rounds": null,
      "venue": "Club Deportivo Huracan, Trelew",
      "bout_rating": 1
    },
    {
      "date": "Feb 18",
      "opponent": "Miguel Eduardo Gorosito",
      "opponent_id": "653535",
      "opponent_url": "https://boxrec.com/en/box-pro/653535",
      "opponent_record": "4-3-0",
      "recent_form": "WWWLLW",
      "result": "W",
      "method": null,
      "rounds": null,
      "venue": "Nuevo Palacio Aurinegro, Puerto Madryn",
      "bout_rating": 0
    },
    {
      "date": "Dec 17",
      "opponent": "Cristian Fabian Rios",
      "opponent_id": "445347",
      "opponent_url": "https://boxrec.com/en/box-pro/445347",
      "opponent_record": "21-9-3",
      "recent_form": "WDLWLL",
      "result": "W",
      "method": null,
      "rounds": null,
      "venue": "Gimnasio Municipal N\u00ba 1, Trelew",
      "bout_rating": 1
    },
    {
      "date": "Jul 17",
      "opponent": "Emiliano German Vivas",
      "opponent_id": "740932",
      "opponent_url": "https://boxrec.com/en/box-pro/740932",
      "opponent_record": "3-6-0",
      "recent_form": "LWLLWL",
      "result": "W",
      "method": null,
      "rounds": null,
      "venue": "Parque La Pedrera, Villa Mercedes",
      "bout_rating": 0
    },
    {
      "date": "Apr 17",
      "opponent": "Carlos Dante Moyano",
      "opponent_id": "738667",
      "opponent_url": "https://boxrec.com/en/box-pro/738667",
      "opponent_record": "4-5-0",
      "recent_form": "LWWLWL",
      "result": "W",
      "method": null,
      "rounds": null,
      "venue": "Club Social y Deportivo San Vicente, Bell Ville",
      "bout_rating": 0
    },
    {
      "date": "Feb 17",
      "opponent": "Gustavo Rene Benitez",
      "opponent_id": "731449",
      "opponent_url": "https://boxrec.com/en/box-pro/731449",
      "opponent_record": "0-3-0",
      "recent_form": "LLL",
      "result": "W",
      "method": null,
      "rounds": null,
      "venue": "Club Ciclista Juninense, Jun\u00edn",
      "bout_rating": 0
    },
    {
      "date": "Jan 17",
      "opponent": "Victor Hugo Exner",
      "opponent_id": "773826",
      "opponent_url": "https://boxrec.com/en/box-pro/773826",
      "opponent_record": "2-1-0",
      "recent_form": "LWW",
      "result": "W",
      "method": null,
      "rounds": null,
      "venue": "Club Social y Deportivo Los Millonarios, Bragado",
      "bout_rating": 1
    },
    {
      "date": "Nov 16",
      "opponent": "Gaston Dario Avalos",
      "opponent_id": "736961",
      "opponent_url": "https://boxrec.com/en/box-pro/736961",
      "opponent_record": "2-3-0",
      "recent_form": "LLWWL",
      "result": "W",
      "method": null,
      "rounds": null,
      "venue": "Polideportivo Fortunato Perazzoli, San Carlos",
      "bout_rating": 0
    }
  ]
}